{
  "$schema": "https://json-schema.org/draft/2020-12/schema",
  "$id": "https://raw.githubusercontent.com/sesigl/open-software-factory/main/contracts/events/pr-closed/pr-closed.schema.json",
  "title": "PrClosed",
  "$comment": "Generated by `pnpm build` in contracts/ from typespec/. Do not edit.",
  "type": "object",
  "properties": {
    "specversion": {
      "type": "string",
      "const": "1.0"
    },
    "id": {
      "type": "string",
      "minLength": 1,
      "maxLength": 128,
      "description": "Unique per source. A consumer that sees the same source and id twice handles the event once."
    },
    "source": {
      "type": "string",
      "minLength": 1,
      "description": "The producing module, for example \"/osf/intake\"."
    },
    "type": {
      "type": "string",
      "const": "pr.closed@v1"
    },
    "time": {
      "type": "string",
      "format": "date-time"
    },
    "subject": {
      "type": "string",
      "description": "The ID of the thing the event is about: work item, gate, run, score or pull request."
    },
    "datacontenttype": {
      "type": "string",
      "const": "application/json"
    },
    "dataschema": {
      "type": "string",
      "format": "uri"
    },
    "traceparent": {
      "type": "string",
      "description": "W3C trace context (CloudEvents distributed tracing extension)."
    },
    "data": {
      "type": "object",
      "properties": {
        "url": {
          "type": "string",
          "format": "uri",
          "description": "The pull request."
        },
        "merged": {
          "type": "boolean",
          "description": "True when the pull request was merged, false when it was closed without a merge."
        },
        "mergeCommit": {
          "type": "string",
          "pattern": "^[0-9a-f]{7,40}$",
          "description": "A Git commit hash, abbreviated (7+) or full. The factory version is the commit of the factory definition."
        }
      },
      "required": [
        "url",
        "merged"
      ]
    }
  },
  "required": [
    "specversion",
    "id",
    "source",
    "type",
    "time",
    "data"
  ],
  "description": "forge adapters: a pull request was merged or closed without a merge."
}
